{"criteria":[{"portable_criterion_ids":["RC-METHOD-SOUNDNESS","RC-CONTRIBUTION-IDENTITY","RC-CLAIM-EVIDENCE"],"rule_id":"sound-contribution","source_anchors":[{"section_anchor":"reviewer-guidelines","source_id":"eccv-2026-reviewer-guide"}],"source_claim_ids":["eccv-2026-main:criterion:sound-contribution"],"source_ids":["eccv-2026-reviewer-guide"],"statement":"Assess technical soundness and meaningful knowledge advancement while avoiding automatic rejection for small repairable issues or absence of state-of-the-art performance."},{"portable_criterion_ids":["RC-CONTRIBUTION-IDENTITY","RC-RELATED-WORK","RC-METHOD-SOUNDNESS","RC-EXPERIMENT-DESIGN","RC-DATA-VALIDITY","RC-REPRODUCIBILITY"],"rule_id":"contribution-type-lens","source_anchors":[{"section_anchor":"contribution-type-interpretation","source_id":"eccv-2026-contribution-types"}],"source_claim_ids":["eccv-2026-main:criterion:contribution-type-lens"],"source_ids":["eccv-2026-contribution-types"],"statement":"Use the author-selected contribution type as the primary evaluation lens, assess the work holistically rather than as a rigid checklist, and explicitly justify any reclassification."},{"portable_criterion_ids":["RC-DISSENT-PRESERVATION","RC-FINDING-EVIDENCE","RC-COMPLETION-TRUTH"],"rule_id":"meta-review-evidence","source_anchors":[{"section_anchor":"meta-review","source_id":"eccv-2026-ac-guidelines"}],"source_claim_ids":["eccv-2026-main:criterion:meta-review-evidence"],"source_ids":["eccv-2026-ac-guidelines"],"statement":"Explain how reviews, rebuttal and discussion support the decision, consider the contribution type, and rely on comments rather than mechanically following scores or confidence."}],"native_assessment_fields":[{"allowed_labels":[],"anchors":[],"direction":"not_applicable","field_id":"justification-of-rating","field_type":"text","maximum":null,"minimum":null,"portable_criterion_ids":["RC-CLAIM-EVIDENCE","RC-CONTRIBUTION-IDENTITY","RC-METHOD-SOUNDNESS"],"prompt":"Record the ECCV 2026 rating justification as text; the public authority does not establish the numeric range, exact labels, or direction mapping.","required":true,"role":"reviewer","source_anchors":[{"section_anchor":"contribution-type-interpretation","source_id":"eccv-2026-contribution-types"}],"source_claim_ids":["eccv-2026-main:native_field:justification-of-rating"],"source_ids":["eccv-2026-contribution-types"]},{"allowed_labels":[],"anchors":[],"direction":"not_applicable","field_id":"final-justification","field_type":"text","maximum":null,"minimum":null,"portable_criterion_ids":["RC-CLAIM-EVIDENCE","RC-REQUIREMENT-LEGITIMACY","RC-DISSENT-PRESERVATION"],"prompt":"Record the final reviewer justification after considering rebuttal and discussion without inventing a score scale.","required":true,"role":"reviewer","source_anchors":[{"section_anchor":"final-justification","source_id":"eccv-2026-ac-guidelines"}],"source_claim_ids":["eccv-2026-main:native_field:final-justification"],"source_ids":["eccv-2026-ac-guidelines"]},{"allowed_labels":[],"anchors":[],"direction":"not_applicable","field_id":"meta-review","field_type":"text","maximum":null,"minimum":null,"portable_criterion_ids":["RC-DISSENT-PRESERVATION","RC-FINDING-EVIDENCE","RC-COMPLETION-TRUTH"],"prompt":"Explain how reviews, rebuttal, discussion, contribution type, and remaining concerns support the paper recommendation.","required":true,"role":"meta_reviewer","source_anchors":[{"section_anchor":"meta-review","source_id":"eccv-2026-ac-guidelines"}],"source_claim_ids":["eccv-2026-main:native_field:meta-review"],"source_ids":["eccv-2026-ac-guidelines"]}],"profile_id":"eccv-2026-main","profile_version":"1.0.0","schema_version":"1.0.0","source_manifest_locator":"venues/source-manifests/eccv-2026-main.json","source_sha256":"b6a5f5f3c3201cdf8ef77db75bae6bedebc52ff624e594b4802a9934a458eff7","track":"main","venue":"ECCV","year":2026}
