{"criteria":[{"portable_criterion_ids":["RC-METHOD-SOUNDNESS","RC-CONTRIBUTION-IDENTITY","RC-CLAIM-EVIDENCE"],"rule_id":"sound-contribution","source_anchors":[{"section_anchor":"how-to-write-good-reviews","source_id":"cvpr-2026-reviewer-guidelines"}],"source_claim_ids":["cvpr-2026-main:criterion:sound-contribution"],"source_ids":["cvpr-2026-reviewer-guidelines"],"statement":"Assess technical soundness and meaningful contribution, grounding the recommendation in a detailed account of strengths and weaknesses."},{"portable_criterion_ids":["RC-CONTRIBUTION-IDENTITY","RC-RELATED-WORK","RC-CLAIM-EVIDENCE","RC-COMPARISON-FAIRNESS"],"rule_id":"balanced-contribution","source_anchors":[{"section_anchor":"how-to-write-good-reviews","source_id":"cvpr-2026-reviewer-guidelines"}],"source_claim_ids":["cvpr-2026-main:criterion:balanced-contribution"],"source_ids":["cvpr-2026-reviewer-guidelines"],"statement":"Balance novelty, potential impact, and empirical performance; failure to exceed state of the art is not by itself a rejection reason."},{"portable_criterion_ids":["RC-REQUIREMENT-LEGITIMACY","RC-RISK-CLASS-SEPARATION"],"rule_id":"repairable-issues","source_anchors":[{"section_anchor":"how-to-write-good-reviews","source_id":"cvpr-2026-reviewer-guidelines"}],"source_claim_ids":["cvpr-2026-main:criterion:repairable-issues"],"source_ids":["cvpr-2026-reviewer-guidelines"],"statement":"Do not let an easily corrected minor flaw become a rejection reason."},{"portable_criterion_ids":["RC-DISSENT-PRESERVATION","RC-FINDING-EVIDENCE","RC-COMPLETION-TRUTH"],"rule_id":"meta-review-evidence","source_anchors":[{"section_anchor":"meta-review","source_id":"cvpr-2026-ac-guidelines"}],"source_claim_ids":["cvpr-2026-main:criterion:meta-review-evidence"],"source_ids":["cvpr-2026-ac-guidelines"],"statement":"Summarize the contribution, reviewer assessments, rebuttal, final reviewer reasons, and the AC recommendation with its rationale."}],"native_assessment_fields":[{"allowed_labels":[],"anchors":[],"direction":"not_applicable","field_id":"rating-and-justification","field_type":"text","maximum":null,"minimum":null,"portable_criterion_ids":["RC-CLAIM-EVIDENCE","RC-CONTRIBUTION-IDENTITY","RC-METHOD-SOUNDNESS"],"prompt":"Record the observed CVPR 2026 rating label and its justification as text; the public authority does not establish a complete numeric scale or exhaustive label enum.","required":true,"role":"reviewer","source_anchors":[{"section_anchor":"review-content","source_id":"cvpr-2026-training"}],"source_claim_ids":["cvpr-2026-main:native_field:rating-and-justification"],"source_ids":["cvpr-2026-training"]},{"allowed_labels":[],"anchors":[],"direction":"not_applicable","field_id":"final-justification","field_type":"text","maximum":null,"minimum":null,"portable_criterion_ids":["RC-CLAIM-EVIDENCE","RC-REQUIREMENT-LEGITIMACY","RC-DISSENT-PRESERVATION"],"prompt":"Record the final evidence-based reviewer justification after considering rebuttal and discussion.","required":true,"role":"reviewer","source_anchors":[{"section_anchor":"finalization","source_id":"cvpr-2026-training"}],"source_claim_ids":["cvpr-2026-main:native_field:final-justification"],"source_ids":["cvpr-2026-training"]},{"allowed_labels":[],"anchors":[],"direction":"not_applicable","field_id":"meta-review","field_type":"text","maximum":null,"minimum":null,"portable_criterion_ids":["RC-DISSENT-PRESERVATION","RC-FINDING-EVIDENCE","RC-COMPLETION-TRUTH"],"prompt":"Summarise the key claims, strengths, weaknesses, rebuttal effects, remaining concerns, and evidence-backed recommendation.","required":true,"role":"meta_reviewer","source_anchors":[{"section_anchor":"meta-review","source_id":"cvpr-2026-ac-guidelines"}],"source_claim_ids":["cvpr-2026-main:native_field:meta-review"],"source_ids":["cvpr-2026-ac-guidelines"]}],"profile_id":"cvpr-2026-main","profile_version":"1.0.0","schema_version":"1.0.0","source_manifest_locator":"venues/source-manifests/cvpr-2026-main.json","source_sha256":"8d2f8500e9f775db2315d0a2590e2b7f1411ceff099cb062073865e6f42c6af0","track":"main","venue":"CVPR","year":2026}
