{"criteria":[{"portable_criterion_ids":["RC-CLAIM-EVIDENCE"],"rule_id":"claims-supported","source_anchors":[{"section_anchor":"acceptance-criteria","source_id":"tmlr-acceptance-criteria"}],"source_claim_ids":["tmlr-current-general:criterion:claims-supported"],"source_ids":["tmlr-acceptance-criteria"],"statement":"Assess whether the main claims are supported by accurate, convincing, and clearly presented evidence; additional evidence or narrower claims are both legitimate closure routes."},{"portable_criterion_ids":["RC-CONTRIBUTION-IDENTITY","RC-PROBLEM-FORMULATION"],"rule_id":"audience-interest","source_anchors":[{"section_anchor":"acceptance-criteria","source_id":"tmlr-acceptance-criteria"}],"source_claim_ids":["tmlr-current-general:criterion:audience-interest"],"source_ids":["tmlr-acceptance-criteria"],"statement":"Assess whether some individuals in TMLR's audience would be interested in the findings; do not substitute novelty, state-of-the-art performance, or predicted impact as independent acceptance gates."}],"native_assessment_fields":[{"allowed_labels":["Yes","No"],"anchors":[{"label":"Yes","value":"Yes"},{"label":"No","value":"No"}],"direction":"not_ordered","field_id":"claims-supported-answer","field_type":"categorical","maximum":null,"minimum":null,"portable_criterion_ids":["RC-CLAIM-EVIDENCE"],"prompt":"Record the TMLR claims-supported answer and justify it from portable evidence.","required":true,"role":"reviewer","source_anchors":[{"section_anchor":"review-format","source_id":"tmlr-reviewer-guide"}],"source_claim_ids":["tmlr-current-general:native_field:claims-supported-answer"],"source_ids":["tmlr-reviewer-guide"]},{"allowed_labels":["Yes","No"],"anchors":[{"label":"Yes","value":"Yes"},{"label":"No","value":"No"}],"direction":"not_ordered","field_id":"audience-interest-answer","field_type":"categorical","maximum":null,"minimum":null,"portable_criterion_ids":["RC-CONTRIBUTION-IDENTITY","RC-PROBLEM-FORMULATION"],"prompt":"Record the TMLR audience-interest answer and justify it from portable evidence.","required":true,"role":"reviewer","source_anchors":[{"section_anchor":"review-format","source_id":"tmlr-reviewer-guide"}],"source_claim_ids":["tmlr-current-general:native_field:audience-interest-answer"],"source_ids":["tmlr-reviewer-guide"]},{"allowed_labels":["accept","leaning accept","leaning reject","reject"],"anchors":[{"label":"accept","value":"accept"},{"label":"leaning accept","value":"leaning accept"},{"label":"leaning reject","value":"leaning reject"},{"label":"reject","value":"reject"}],"direction":"not_ordered","field_id":"official-recommendation","field_type":"categorical","maximum":null,"minimum":null,"portable_criterion_ids":["RC-CLAIM-EVIDENCE","RC-CONTRIBUTION-IDENTITY","RC-PROBLEM-FORMULATION"],"prompt":"After discussion, record one official TMLR reviewer recommendation label and keep the result categorical and non-probabilistic.","required":true,"role":"reviewer","source_anchors":[{"section_anchor":"official-recommendation","source_id":"tmlr-reviewer-guide"}],"source_claim_ids":["tmlr-current-general:native_field:official-recommendation"],"source_ids":["tmlr-reviewer-guide"]},{"allowed_labels":["Accept","Accept with minor revision","Reject"],"anchors":[{"label":"Accept","value":"Accept"},{"label":"Accept with minor revision","value":"Accept with minor revision"},{"label":"Reject","value":"Reject"}],"direction":"not_ordered","field_id":"action-editor-decision","field_type":"categorical","maximum":null,"minimum":null,"portable_criterion_ids":["RC-CLAIM-EVIDENCE","RC-CONTRIBUTION-IDENTITY","RC-COMPLETION-TRUTH"],"prompt":"Record the simulated Action Editor decision using only the official categorical outcomes and portable evidence.","required":true,"role":"meta_reviewer","source_anchors":[{"section_anchor":"action-editor-outcomes","source_id":"tmlr-ae-guide"}],"source_claim_ids":["tmlr-current-general:native_field:action-editor-decision"],"source_ids":["tmlr-ae-guide"]}],"profile_id":"tmlr-current-general","profile_version":"1.0.0","schema_version":"1.0.0","source_manifest_locator":"venues/source-manifests/tmlr-current.json","source_sha256":"8740691bc7c66bd3c2e9882268097ed9e429f21c1204be099a988feffb244a85","track":null,"venue":"TMLR","year":null}
